{
  "clock": {
    "now": 1792569648
  },
  "services": [
    {
      "id": "datastore",
      "document": {
        "server": "datastore",
        "resource_types": [
          {
            "name": "host",
            "parent": "service",
            "description": "One database server."
          },
          {
            "name": "database",
            "parent": "host",
            "description": "One database."
          },
          {
            "name": "table",
            "parent": "database",
            "description": "One table."
          }
        ],
        "actions": [
          {
            "name": "data.read",
            "resource_types": [
              "service",
              "host",
              "database",
              "table"
            ],
            "description": "Read data.",
            "limits": [
              "requests",
              "max_rows",
              "max_duration"
            ]
          },
          {
            "name": "data.write",
            "resource_types": [
              "service",
              "host",
              "database",
              "table"
            ],
            "description": "Change data.",
            "limits": [
              "requests",
              "max_duration"
            ]
          }
        ],
        "resources": [
          {
            "path": "host:prod",
            "label": "Production"
          }
        ],
        "limits": [
          {
            "name": "requests",
            "label": "Requests",
            "description": "Requests that run.",
            "unit": "request",
            "kind": "budget"
          },
          {
            "name": "max_rows",
            "label": "Most rows",
            "description": "The most rows that one read gives.",
            "unit": "row",
            "kind": "ceiling",
            "min": 1,
            "max": 1000000
          },
          {
            "name": "max_duration",
            "label": "Longest run",
            "description": "The longest run of one use, in seconds.",
            "unit": "second",
            "kind": "ceiling",
            "min": 1,
            "max": 600
          }
        ]
      }
    }
  ],
  "subjects": [
    {
      "id": "alice",
      "grants": [
        {
          "action": "access",
          "resource": "service:datastore",
          "limits": {
            "requests": [
              {
                "amount": 10,
                "window": "second"
              },
              {
                "amount": 300,
                "window": "minute"
              }
            ]
          }
        },
        {
          "action": "data.read",
          "resource": "service:datastore/host:prod/database:test1",
          "limits": {
            "max_rows": 1000
          }
        },
        {
          "action": "data.read",
          "resource": "service:datastore/host:prod/database:test2",
          "limits": {
            "max_rows": 5000,
            "max_duration": 30
          }
        },
        {
          "action": "data.read",
          "resource": "service:datastore/host:prod/database:test2/table:orders",
          "limits": {
            "max_rows": 100
          }
        },
        {
          "action": "data.write",
          "resource": "service:datastore/host:prod/database:test2",
          "limits": {
            "max_duration": 10
          }
        }
      ]
    },
    {
      "id": "key:9b1c04e2aa71f0c3",
      "owner": "alice",
      "grants": [
        {
          "action": "access",
          "resource": "service:datastore",
          "limits": {
            "requests": [
              {
                "amount": 100,
                "window": "minute"
              }
            ]
          }
        },
        {
          "action": "data.read",
          "resource": "service:datastore/host:prod/database:test2",
          "limits": {
            "max_rows": 10000
          }
        }
      ]
    },
    {
      "id": "bob",
      "grants": [
        {
          "action": "access",
          "resource": "service:datastore",
          "limits": {
            "requests": [
              {
                "amount": 5,
                "window": "second"
              }
            ]
          }
        },
        {
          "action": "data.read",
          "resource": "service:datastore/host:prod/database:test1"
        }
      ]
    },
    {
      "id": "key:4d2e8f6a10b37c95",
      "owner": "bob",
      "grants": [
        {
          "action": "access",
          "resource": "service:datastore"
        },
        {
          "action": "data.read",
          "resource": "service:datastore/host:prod/database:test2"
        }
      ]
    }
  ],
  "counters": [
    {
      "subject": "key:9b1c04e2aa71f0c3",
      "limit": "requests",
      "window": "minute",
      "used": 98
    },
    {
      "subject": "alice",
      "limit": "requests",
      "window": "second",
      "used": 8
    },
    {
      "subject": "alice",
      "limit": "requests",
      "window": "minute",
      "used": 298
    }
  ],
  "metadata": {
    "usage_max_seconds": 5,
    "idle_max_seconds": 30,
    "evaluations_max_bytes": 65536,
    "evaluations_max_items": 50
  },
  "failures": [
    {
      "kind": "delay",
      "delay_ms": 250,
      "when": {
        "subject": "bob",
        "usage": true
      },
      "times": 1
    }
  ]
}
